<?xml version="1.0" encoding="UTF-8"?>
<tns:Configuration hierarchy="ba" description="Bosnia and Herzegovina"
	xmlns:tns="http://jollyday.sourceforge.net/Jollyday" xmlns:xsi="http://www.w3.org/2001/XMLSchema-instance"
	xsi:schemaLocation="http://jollyday.sourceforge.net/Jollyday ../Holiday.xsd">
	<tns:Holiday>
		<tns:Fixed month="JANUARY" day="1" descriptionPropertiesKey="NEW_YEAR" />
	</tns:Holiday>
	<tns:Holiday>
		<tns:Fixed month="JANUARY" day="7" descriptionPropertiesKey="CHRISTMAS" />
	</tns:Holiday>
	<tns:Holiday>
		<tns:Fixed month="JANUARY" day="14"
			descriptionPropertiesKey="NEW_YEAR" />
	</tns:Holiday>
	<tns:Holiday>
		<tns:Fixed month="MAY" day="1" descriptionPropertiesKey="MAY_DAY" />
	</tns:Holiday>
	<tns:Holiday>
		<tns:Fixed month="MAY" day="6" descriptionPropertiesKey="ST_GEORGE" />
	</tns:Holiday>
	<tns:Holiday>
		<tns:Fixed month="JUNE" day="28" descriptionPropertiesKey="ST_VITUS" />
	</tns:Holiday>
	<tns:Holiday>
		<tns:Fixed month="JULY" day="12" descriptionPropertiesKey="ST_PETER" />
	</tns:Holiday>
	<tns:Holiday>
		<tns:Fixed month="AUGUST" day="2" descriptionPropertiesKey="ST_ELIJAH" />
	</tns:Holiday>
	<tns:Holiday>
		<tns:Fixed month="AUGUST" day="15" descriptionPropertiesKey="ASSUMPTION_DAY" />
	</tns:Holiday>
	<tns:Holiday>
		<tns:Fixed month="AUGUST" day="28" descriptionPropertiesKey="ASSUMPTION_DAY" />
	</tns:Holiday>
	<tns:Holiday>
		<tns:Fixed month="SEPTEMBER" day="8"
			descriptionPropertiesKey="NATIVITY_MARY" />
	</tns:Holiday>
	<tns:Holiday>
		<tns:Fixed month="SEPTEMBER" day="21"
			descriptionPropertiesKey="NATIVITY_MARY" />
	</tns:Holiday>
	<tns:Holiday>
		<tns:Fixed month="NOVEMBER" day="1"
			descriptionPropertiesKey="ALL_SAINTS" />
	</tns:Holiday>
	<tns:Holiday>
		<tns:Fixed month="NOVEMBER" day="2"
			descriptionPropertiesKey="ALL_SOULS" />
	</tns:Holiday>
	<tns:Holiday>
		<tns:Fixed month="NOVEMBER" day="8"
			descriptionPropertiesKey="ST_DEMETRIUS" />
	</tns:Holiday>
	<tns:Holiday>
		<tns:Fixed month="DECEMBER" day="25"
			descriptionPropertiesKey="CHRISTMAS" />
	</tns:Holiday>
	<tns:Holiday>
		<tns:IslamicHoliday type="ID_AL_FITR" />
	</tns:Holiday>
	<tns:Holiday>
		<tns:IslamicHoliday type="ID_UL_ADHA" />
	</tns:Holiday>
	<tns:Holiday>
		<tns:IslamicHoliday type="MAWLID_AN_NABI" />
	</tns:Holiday>
	<tns:SubConfigurations hierarchy="rs"
		description="Republika Srpska">
		<tns:Holiday>
			<tns:Fixed month="JANUARY" day="9"
				descriptionPropertiesKey="REPUBLIC_DAY" />
		</tns:Holiday>
		<tns:Holiday>
			<tns:Fixed month="MAY" day="9" descriptionPropertiesKey="VICTORY" />
		</tns:Holiday>
		<tns:Holiday>
			<tns:Fixed month="NOVEMBER" day="21"
				descriptionPropertiesKey="DAYTON" />
		</tns:Holiday>
	</tns:SubConfigurations>
	<tns:SubConfigurations hierarchy="fbh"
		description="Federation of Bosnia and Herzegovina">
		<tns:Holiday>
			<tns:Fixed month="MARCH" day="1" descriptionPropertiesKey="INDEPENDENCE" />
		</tns:Holiday>
		<tns:Holiday>
			<tns:Fixed month="NOVEMBER" day="25"
				descriptionPropertiesKey="NATIONAL_DAY" />
		</tns:Holiday>
	</tns:SubConfigurations>
</tns:Configuration>
