<?xml version="1.0" encoding="UTF-8"?>
<tns:Configuration hierarchy="ng" description="Nigeria"
	xmlns:tns="http://jollyday.sourceforge.net/Jollyday" xmlns:xsi="http://www.w3.org/2001/XMLSchema-instance"
	xsi:schemaLocation="http://jollyday.sourceforge.net/Jollyday ../Holiday.xsd">
	<tns:Holiday>
		<tns:Fixed month="JANUARY" day="1" descriptionPropertiesKey="NEW_YEAR" />
	</tns:Holiday>
	<tns:Holiday>
		<tns:Fixed month="MAY" day="1" descriptionPropertiesKey="LABOUR_DAY" />
	</tns:Holiday>
	<tns:Holiday>
		<tns:Fixed month="MAY" day="27" descriptionPropertiesKey="CHILDRENS_DAY" />
	</tns:Holiday>
	<tns:Holiday>
		<tns:Fixed month="MAY" day="29" descriptionPropertiesKey="FREEDOM_DEMOCRACY" />
	</tns:Holiday>
	<tns:Holiday>
		<tns:Fixed month="OCTOBER" day="1" descriptionPropertiesKey="INDEPENDENCE" />
	</tns:Holiday>
	<tns:Holiday>
		<tns:Fixed month="DECEMBER" day="25"
			descriptionPropertiesKey="CHRISTMAS" />
	</tns:Holiday>
	<tns:Holiday>
		<tns:Fixed month="DECEMBER" day="26"
			descriptionPropertiesKey="BOXING_DAY" />
	</tns:Holiday>
	<tns:Holiday>
		<tns:ChristianHoliday type="EASTER" />
	</tns:Holiday>
	<tns:Holiday>
		<tns:ChristianHoliday type="GOOD_FRIDAY" />
	</tns:Holiday>
	<tns:Holiday>
		<tns:ChristianHoliday type="EASTER_MONDAY" />
	</tns:Holiday>
	<tns:Holiday>
		<tns:IslamicHoliday type="RAMADAN" />
	</tns:Holiday>
	<tns:Holiday>
		<tns:IslamicHoliday type="MAWLID_AN_NABI" />
	</tns:Holiday>
	<tns:Holiday>
		<tns:IslamicHoliday type="ID_AL_FITR" />
	</tns:Holiday>
	<tns:Holiday>
		<tns:IslamicHoliday type="ID_UL_ADHA" />
	</tns:Holiday>
	<tns:SubConfigurations hierarchy="lag"
		description="Lagos">
		<tns:Holiday>
			<tns:Fixed month="JUNE" day="12" descriptionPropertiesKey="ELECTION" />
		</tns:Holiday>
	</tns:SubConfigurations>
</tns:Configuration>
