<?xml version="1.0" encoding="UTF-8"?>
<tns:Configuration hierarchy="br" description="Brazil"
	xmlns:tns="http://jollyday.sourceforge.net/Jollyday" xmlns:xsi="http://www.w3.org/2001/XMLSchema-instance"
	xsi:schemaLocation="http://jollyday.sourceforge.net/Jollyday ../Holiday.xsd">
	<tns:Holiday>
		<tns:Fixed month="JANUARY" day="1" descriptionPropertiesKey="NEW_YEAR" />
	</tns:Holiday>
	<tns:Holiday>
		<tns:Fixed month="APRIL" day="21" descriptionPropertiesKey="TIRADENTES" />
	</tns:Holiday>
	<tns:Holiday>
		<tns:Fixed month="MAY" day="1" descriptionPropertiesKey="LABOUR_DAY" />
	</tns:Holiday>
	<tns:Holiday>
		<tns:Fixed month="SEPTEMBER" day="7"
			descriptionPropertiesKey="INDEPENDENCE" />
	</tns:Holiday>
	<tns:Holiday validFrom="1980">
		<tns:Fixed month="OCTOBER" day="12"
			descriptionPropertiesKey="APARECIDA" />
	</tns:Holiday>
	<tns:Holiday>
		<tns:Fixed month="NOVEMBER" day="2"
			descriptionPropertiesKey="ALL_SOULS" />
	</tns:Holiday>
	<tns:Holiday>
		<tns:Fixed month="NOVEMBER" day="15"
			descriptionPropertiesKey="NATIONAL_DAY" />
	</tns:Holiday>
	<tns:Holiday>
		<tns:Fixed month="DECEMBER" day="25"
			descriptionPropertiesKey="CHRISTMAS" />
	</tns:Holiday>
	<tns:Holiday>
		<tns:ChristianHoliday type="EASTER" />
	</tns:Holiday>
	<tns:Holiday>
		<tns:ChristianHoliday type="CARNIVAL" />
	</tns:Holiday>
	<tns:Holiday>
		<tns:ChristianHoliday type="ASH_WEDNESDAY" />
	</tns:Holiday>
	<tns:Holiday>
		<tns:ChristianHoliday type="GOOD_FRIDAY" />
	</tns:Holiday>
	<tns:Holiday>
		<tns:ChristianHoliday type="CORPUS_CHRISTI" />
	</tns:Holiday>
	<tns:SubConfigurations hierarchy="rj"
		description="Rio de Janeiro">
		<tns:Holiday validFrom="2007">
			<tns:Fixed month="APRIL" day="23" descriptionPropertiesKey="ST_GEORGE" />
		</tns:Holiday>
		<tns:Holiday>
			<tns:Fixed month="NOVEMBER" day="20"
				descriptionPropertiesKey="BLACK_AWARENESS" />
		</tns:Holiday>
		<tns:SubConfigurations hierarchy="crj"
			description="City of Rio de Janeiro">
			<tns:Holiday>
				<tns:Fixed month="JANUARY" day="20"
					descriptionPropertiesKey="ST_SEBASTIAN" />
			</tns:Holiday>
			<tns:Holiday validTo="2006">
				<tns:Fixed month="APRIL" day="23"
					descriptionPropertiesKey="ST_GEORGE" />
			</tns:Holiday>
		</tns:SubConfigurations>
	</tns:SubConfigurations>
	<tns:SubConfigurations hierarchy="s" description="Sao Paulo">
		<tns:Holiday>
			<tns:Fixed month="JULY" day="9" descriptionPropertiesKey="CONST_REVOLUTION" />
		</tns:Holiday>
		<tns:Holiday>
			<tns:Fixed month="NOVEMBER" day="20"
				descriptionPropertiesKey="BLACK_AWARENESS" />
		</tns:Holiday>
		<tns:SubConfigurations hierarchy="cs"
			description="City of Sao Paulo">
			<tns:Holiday>
				<tns:Fixed month="JANUARY" day="25"
					descriptionPropertiesKey="FOUNDATION" />
			</tns:Holiday>
			<tns:Holiday>
				<tns:Fixed month="NOVEMBER" day="4"
					descriptionPropertiesKey="FOUNDATION" />
			</tns:Holiday>
		</tns:SubConfigurations>
	</tns:SubConfigurations>
	<tns:SubConfigurations hierarchy="mg"
		description="Minas Gerais">
		<tns:SubConfigurations hierarchy="bh"
			description="Belo Horizonte">
			<tns:Holiday>
				<tns:Fixed month="AUGUST" day="15"
					descriptionPropertiesKey="LADY_GOOD_VOYAGE" />
			</tns:Holiday>
			<tns:Holiday>
				<tns:Fixed month="DECEMBER" day="8"
					descriptionPropertiesKey="LADY_CONCEICAO" />
			</tns:Holiday>
		</tns:SubConfigurations>
	</tns:SubConfigurations>
	<tns:SubConfigurations hierarchy="ms"
		description="Mato Grosso do Sul">
		<tns:Holiday>
			<tns:Fixed month="OCTOBER" day="11"
				descriptionPropertiesKey="FOUNDATION" />
		</tns:Holiday>
		<tns:SubConfigurations hierarchy="cg"
			description="Campo Grande">
			<tns:Holiday>
				<tns:Fixed month="AUGUST" day="26"
					descriptionPropertiesKey="FOUNDATION" />
			</tns:Holiday>
		</tns:SubConfigurations>
		<tns:SubConfigurations hierarchy="do"
			description="Dourados">
			<tns:Holiday>
				<tns:Fixed month="DECEMBER" day="8"
					descriptionPropertiesKey="LADY_CONCEICAO" />
			</tns:Holiday>
		</tns:SubConfigurations>
	</tns:SubConfigurations>
	<tns:SubConfigurations hierarchy="pr"
		description="Parana">
		<tns:SubConfigurations hierarchy="cu"
			description="Curitiba">
			<tns:Holiday>
				<tns:Fixed month="SEPTEMBER" day="8"
					descriptionPropertiesKey="LADY_LIGHT_PINE" />
			</tns:Holiday>
		</tns:SubConfigurations>
	</tns:SubConfigurations>
	<tns:SubConfigurations hierarchy="rs"
		description="Rio Grande do Sul">
		<tns:Holiday>
			<tns:Fixed month="SEPTEMBER" day="20"
				descriptionPropertiesKey="FARROUS_REVOLUTION" />
		</tns:Holiday>
		<tns:SubConfigurations hierarchy="sm"
			description="Santa Maria">
			<tns:Holiday>
				<tns:Fixed month="DECEMBER" day="8"
					descriptionPropertiesKey="LADY_CONCEICAO" />
			</tns:Holiday>
		</tns:SubConfigurations>
	</tns:SubConfigurations>
	<tns:SubConfigurations hierarchy="rn"
		description="Rio Grande do Norte">
		<tns:Holiday>
			<tns:Fixed month="OCTOBER" day="3"
				descriptionPropertiesKey="MARTYRS_DAY" />
		</tns:Holiday>
		<tns:SubConfigurations hierarchy="na"
			description="Natal">
			<tns:Holiday>
				<tns:Fixed month="NOVEMBER" day="21"
					descriptionPropertiesKey="LADY_APRESENTACAO" />
			</tns:Holiday>
		</tns:SubConfigurations>
	</tns:SubConfigurations>
	<tns:SubConfigurations hierarchy="go"
		description="GoiÃ¡s">
		<tns:Holiday>
			<tns:Fixed month="OCTOBER" day="24"
				descriptionPropertiesKey="FOUNDATION" />
		</tns:Holiday>
	</tns:SubConfigurations>
	<tns:SubConfigurations hierarchy="pe"
		description="Pernambuco">
		<tns:Holiday>
			<tns:Fixed month="DECEMBER" day="8"
				descriptionPropertiesKey="LADY_CONCEICAO" />
		</tns:Holiday>
	</tns:SubConfigurations>
</tns:Configuration>
