<?xml version="1.0" encoding="UTF-8"?>
<tns:Configuration hierarchy="pa" description="Panama"
	xmlns:tns="http://www.example.org/Holiday" xmlns:xsi="http://www.w3.org/2001/XMLSchema-instance"
	xsi:schemaLocation="http://www.example.org/Holiday /Holiday.xsd">
	<tns:Holidays>
		<tns:Fixed month="JANUARY" day="1" />
		<tns:Fixed month="JANUARY" day="9" />
		<tns:Fixed month="MAY" day="1" />
		<tns:Fixed month="NOVEMBER" day="3" />
		<tns:Fixed month="NOVEMBER" day="4" />
		<tns:Fixed month="NOVEMBER" day="5" />
		<tns:Fixed month="NOVEMBER" day="10" />
		<tns:Fixed month="NOVEMBER" day="28" />
		<tns:Fixed month="DECEMBER" day="8" />
		<tns:Fixed month="DECEMBER" day="25" />
		<tns:ChristianHoliday type="EASTER" />
		<tns:ChristianHoliday type="CLEAN_MONDAY"/>
		<tns:ChristianHoliday type="CARNIVAL"/>
		<tns:ChristianHoliday type="GOOD_FRIDAY"/>
	</tns:Holidays>
</tns:Configuration>
