<?xml version="1.0" encoding="UTF-8"?>
<tns:Configuration hierarchy="test" description="Test holidays"
	xmlns:tns="http://jollyday.sourceforge.net/Jollyday" xmlns:xsi="http://www.w3.org/2001/XMLSchema-instance"
	xsi:schemaLocation="http://jollyday.sourceforge.net/Jollyday ../../../main/resources/Holiday.xsd">
	<tns:Holiday>
		<tns:Fixed month="JANUARY" day="1" />
	</tns:Holiday>
	<tns:Holiday>
		<tns:Fixed month="JANUARY" day="16" />
		<tns:MovingCondition to="NEXT" weekday="MONDAY">
			<tns:when>SATURDAY</tns:when>
			<tns:when>SUNDAY</tns:when>
		</tns:MovingCondition>
	</tns:Holiday>
	<tns:Holiday>
		<tns:Fixed month="NOVEMBER" day="23"/>
		<tns:MovingCondition to="PREVIOUS" weekday="WEDNESDAY"/>
	</tns:Holiday>
	<tns:Holiday>
		<tns:FixedWeekdayInMonth which="FOURTH" weekday="MONDAY"
				month="NOVEMBER" />
		<tns:MovingCondition to="NEXT" weekday="FRIDAY">
			<tns:when>MONDAY</tns:when>
		</tns:MovingCondition>
	</tns:Holiday>
	<tns:Holiday>
		<tns:FixedWeekdayInMonth which="LAST" weekday="MONDAY"
			month="AUGUST" />
	</tns:Holiday>
	<tns:Holiday>
		<tns:ChristianHoliday type="GOOD_FRIDAY" />
	</tns:Holiday>
	<tns:Holiday>
		<tns:ChristianHoliday type="EASTER_MONDAY"
			chronology="GREGORIAN" />
	</tns:Holiday>
	<tns:Holiday>
		<tns:ChristianHoliday type="ASH_WEDNESDAY" />
	</tns:Holiday>
	<tns:SubConfigurations hierarchy="level1">
		<tns:Holiday>
			<tns:Fixed month="JANUARY" day="2" />
		</tns:Holiday>
		<tns:SubConfigurations hierarchy="level2">
			<tns:Holiday>
				<tns:Fixed month="JANUARY" day="3" />
			</tns:Holiday>
</tns:SubConfigurations>
</tns:SubConfigurations>
	<tns:SubConfigurations hierarchy="level11">
		<tns:Holiday>
			<tns:IslamicHoliday type="ID_AL_FITR" />
		</tns:Holiday>
		<tns:Holiday>
			<tns:IslamicHoliday type="NEWYEAR" />
		</tns:Holiday>
		<tns:Holiday>
			<tns:IslamicHoliday type="ASCHURA" />
		</tns:Holiday>
		<tns:Holiday>
			<tns:IslamicHoliday type="LAILAT_AL_BARAT" />
		</tns:Holiday>
		<tns:Holiday>
			<tns:IslamicHoliday type="LAILAT_AL_MIRAJ" />
		</tns:Holiday>
		<tns:Holiday>
			<tns:IslamicHoliday type="LAILAT_AL_QADR" />
		</tns:Holiday>
		<tns:Holiday>
			<tns:IslamicHoliday type="MAWLID_AN_NABI" />
		</tns:Holiday>
		<tns:Holiday>
			<tns:IslamicHoliday type="RAMADAN" />
		</tns:Holiday>
	</tns:SubConfigurations>
</tns:Configuration>
