<?xml version="1.0" encoding="UTF-8"?>
<tns:Configuration hierarchy="za" description="South Africa"
	xmlns:tns="http://jollyday.sourceforge.net/Jollyday" xmlns:xsi="http://www.w3.org/2001/XMLSchema-instance"
	xsi:schemaLocation="http://jollyday.sourceforge.net/Jollyday ../Holiday.xsd">
	<tns:Holiday>
		<tns:Fixed month="JANUARY" day="1" descriptionPropertiesKey="NEW_YEAR" />
		<tns:MovingCondition to="NEXT" weekday="MONDAY">
			<tns:when>SUNDAY</tns:when>
		</tns:MovingCondition>
	</tns:Holiday>
	<tns:Holiday validFrom="2000" validTo="2000">
		<tns:Fixed month="JANUARY" day="2" descriptionPropertiesKey="NEW_YEAR" />
		<tns:MovingCondition to="NEXT" weekday="MONDAY">
			<tns:when>SUNDAY</tns:when>
		</tns:MovingCondition>
	</tns:Holiday>
	<tns:Holiday>
		<tns:Fixed month="MARCH" day="21" descriptionPropertiesKey="HUMAN_RIGHTS" />
		<tns:MovingCondition to="NEXT" weekday="MONDAY">
			<tns:when>SUNDAY</tns:when>
		</tns:MovingCondition>
	</tns:Holiday>
	<tns:Holiday validFrom="1952" validTo="1974">
		<tns:Fixed month="APRIL" day="6" descriptionPropertiesKey="RIEBEECK" />
	</tns:Holiday>
	<tns:Holiday validFrom="1980" validTo="1994">
		<tns:Fixed month="APRIL" day="6" descriptionPropertiesKey="FOUNDATION" />
	</tns:Holiday>
	<tns:Holiday>
		<tns:Fixed month="APRIL" day="27" descriptionPropertiesKey="FREEDOM" />
		<tns:MovingCondition to="NEXT" weekday="MONDAY">
			<tns:when>SUNDAY</tns:when>
		</tns:MovingCondition>
	</tns:Holiday>
	<tns:Holiday validFrom="1990">
		<tns:Fixed month="MAY" day="1" descriptionPropertiesKey="LABOUR_DAY" />
		<tns:MovingCondition to="NEXT" weekday="MONDAY">
			<tns:when>SUNDAY</tns:when>
		</tns:MovingCondition>
	</tns:Holiday>
	<tns:Holiday validFrom="2008" validTo="2008">
		<tns:Fixed month="MAY" day="2" descriptionPropertiesKey="HUMAN_RIGHTS" />
		<tns:MovingCondition to="NEXT" weekday="MONDAY">
			<tns:when>SUNDAY</tns:when>
		</tns:MovingCondition>
	</tns:Holiday>
	<tns:Holiday validFrom="1910" validTo="1951">
		<tns:Fixed month="MAY" day="24" descriptionPropertiesKey="EMPIRE" />
	</tns:Holiday>
	<tns:Holiday validFrom="1910" validTo="1993">
		<tns:Fixed month="MAY" day="31" descriptionPropertiesKey="REPUBLIC_DAY" />
	</tns:Holiday>
	<tns:Holiday>
		<tns:Fixed month="JUNE" day="16" descriptionPropertiesKey="YOUTH" />
		<tns:MovingCondition to="NEXT" weekday="MONDAY">
			<tns:when>SUNDAY</tns:when>
		</tns:MovingCondition>
	</tns:Holiday>
	<tns:Holiday validFrom="1961" validTo="1974">
		<tns:Fixed month="JULY" day="10" />
	</tns:Holiday>
	<tns:Holiday>
		<tns:Fixed month="AUGUST" day="9" descriptionPropertiesKey="INTERNATIONAL_WOMAN" />
		<tns:MovingCondition to="NEXT" weekday="MONDAY">
			<tns:when>SUNDAY</tns:when>
		</tns:MovingCondition>
	</tns:Holiday>
	<tns:Holiday>
		<tns:Fixed month="SEPTEMBER" day="24"
			descriptionPropertiesKey="HERITAGE" />
		<tns:MovingCondition to="NEXT" weekday="MONDAY">
			<tns:when>SUNDAY</tns:when>
		</tns:MovingCondition>
	</tns:Holiday>
	<tns:Holiday validFrom="1952" validTo="1993">
		<tns:Fixed month="OCTOBER" day="10"
			descriptionPropertiesKey="KRUGER" />
	</tns:Holiday>
	<tns:Holiday>
		<tns:Fixed month="DECEMBER" day="16"
			descriptionPropertiesKey="RECONCILIATION" />
		<tns:MovingCondition to="NEXT" weekday="MONDAY">
			<tns:when>SUNDAY</tns:when>
		</tns:MovingCondition>
	</tns:Holiday>
	<tns:Holiday>
		<tns:Fixed month="DECEMBER" day="25"
			descriptionPropertiesKey="CHRISTMAS" />
		<tns:MovingCondition to="NEXT" weekday="MONDAY">
			<tns:when>SUNDAY</tns:when>
		</tns:MovingCondition>
	</tns:Holiday>
	<tns:Holiday>
		<tns:Fixed month="DECEMBER" day="26"
			descriptionPropertiesKey="GOODWILL" />
		<tns:MovingCondition to="NEXT" weekday="MONDAY">
			<tns:when>SUNDAY</tns:when>
		</tns:MovingCondition>
	</tns:Holiday>
	<tns:Holiday validFrom="1999" validTo="1999">
		<tns:Fixed month="DECEMBER" day="31"
			descriptionPropertiesKey="NEW_YEAR" />
		<tns:MovingCondition to="NEXT" weekday="MONDAY">
			<tns:when>SUNDAY</tns:when>
		</tns:MovingCondition>
	</tns:Holiday>
	<tns:Holiday validFrom="1987" validTo="1989">
		<tns:FixedWeekdayInMonth which="FIRST"
			weekday="FRIDAY" month="MAY" descriptionPropertiesKey="LABOUR_DAY" />
	</tns:Holiday>
	<tns:Holiday validFrom="1952" validTo="1960">
		<tns:FixedWeekdayInMonth which="SECOND"
			weekday="MONDAY" month="JULY" descriptionPropertiesKey="QUEENS_BIRTHDAY" />
	</tns:Holiday>
	<tns:Holiday validTo="1951">
		<tns:FixedWeekdayInMonth which="FIRST"
			weekday="MONDAY" month="AUGUST" descriptionPropertiesKey="KINGS_DAY" />
	</tns:Holiday>
	<tns:Holiday validFrom="1952" validTo="1979">
		<tns:FixedWeekdayInMonth which="FIRST"
			weekday="MONDAY" month="SEPTEMBER" descriptionPropertiesKey="SETTLER" />
	</tns:Holiday>
	<tns:Holiday>
		<tns:ChristianHoliday type="EASTER" />
	</tns:Holiday>
	<tns:Holiday>
		<tns:ChristianHoliday type="GOOD_FRIDAY" />
	</tns:Holiday>
	<tns:Holiday>
		<tns:ChristianHoliday type="EASTER_MONDAY" />
	</tns:Holiday>
	<tns:Holiday validFrom="1910" validTo="1993">
		<tns:ChristianHoliday type="ASCENSION_DAY" />
	</tns:Holiday>
</tns:Configuration>
