<?xml version="1.0" encoding="UTF-8"?>
<tns:Configuration hierarchy="ua" description="Ukraine"
	xmlns:tns="http://jollyday.sourceforge.net/Jollyday" xmlns:xsi="http://www.w3.org/2001/XMLSchema-instance"
	xsi:schemaLocation="http://jollyday.sourceforge.net/Jollyday ../Holiday.xsd">
	<tns:Holiday>
		<tns:Fixed month="JANUARY" day="1" descriptionPropertiesKey="NEW_YEAR" />
	</tns:Holiday>
	<tns:Holiday>
		<tns:Fixed month="JANUARY" day="7" descriptionPropertiesKey="CHRISTMAS" />
	</tns:Holiday>
	<tns:Holiday>
		<tns:Fixed month="MARCH" day="8" descriptionPropertiesKey="INTERNATIONAL_WOMAN" />
	</tns:Holiday>
	<tns:Holiday>
		<tns:Fixed month="MAY" day="1" descriptionPropertiesKey="LABOUR_DAY" />
	</tns:Holiday>
	<tns:Holiday>
		<tns:Fixed month="MAY" day="2" descriptionPropertiesKey="LABOUR_DAY" />
	</tns:Holiday>
	<tns:Holiday>
		<tns:Fixed month="MAY" day="9" descriptionPropertiesKey="VICTORY" />
	</tns:Holiday>
	<tns:Holiday>
		<tns:Fixed month="JUNE" day="28" descriptionPropertiesKey="CONSTITUTION_DAY" />
	</tns:Holiday>
	<tns:Holiday>
		<tns:Fixed month="AUGUST" day="24" descriptionPropertiesKey="INDEPENDENCE" />
	</tns:Holiday>
	<tns:Holiday>
		<tns:ChristianHoliday type="EASTER" chronology="JULIAN" />
	</tns:Holiday>
	<tns:Holiday>
		<tns:ChristianHoliday type="EASTER_MONDAY"
			chronology="JULIAN" />
	</tns:Holiday>
	<tns:Holiday>
		<tns:ChristianHoliday type="PENTECOST"
			chronology="JULIAN" />
	</tns:Holiday>
</tns:Configuration>
