<?xml version="1.0" encoding="UTF-8"?>
<tns:Configuration hierarchy="al" description="Albania"
	xmlns:tns="http://jollyday.sourceforge.net/Jollyday" xmlns:xsi="http://www.w3.org/2001/XMLSchema-instance"
	xsi:schemaLocation="http://jollyday.sourceforge.net/Jollyday ../Holiday.xsd">
	<tns:Holiday>
		<tns:Fixed month="JANUARY" day="1" descriptionPropertiesKey="NEW_YEAR"/>
		<tns:MovingCondition to="NEXT" weekday="MONDAY">
			<tns:when>SATURDAY</tns:when>
			<tns:when>SUNDAY</tns:when>
		</tns:MovingCondition>
	</tns:Holiday>
	<tns:Holiday>
		<tns:Fixed month="JANUARY" day="2" descriptionPropertiesKey="NEW_YEAR"/>
		<tns:MovingCondition to="NEXT" weekday="MONDAY">
			<tns:when>SATURDAY</tns:when>
			<tns:when>SUNDAY</tns:when>
		</tns:MovingCondition>
	</tns:Holiday>
	<tns:Holiday validFrom="2004">
		<tns:Fixed month="MARCH" day="14" descriptionPropertiesKey="SPRING_DAY"/>
		<tns:MovingCondition to="NEXT" weekday="MONDAY">
			<tns:when>SATURDAY</tns:when>
			<tns:when>SUNDAY</tns:when>
		</tns:MovingCondition>
	</tns:Holiday>
	<tns:Holiday>
		<tns:Fixed month="MAY" day="1" descriptionPropertiesKey="LABOUR_DAY"/>
		<tns:MovingCondition to="NEXT" weekday="MONDAY">
			<tns:when>SATURDAY</tns:when>
			<tns:when>SUNDAY</tns:when>
		</tns:MovingCondition>
	</tns:Holiday>
	<tns:Holiday validFrom="2003">
		<tns:Fixed month="OCTOBER" day="19" descriptionPropertiesKey="MOTHER_TERESA"/>
		<tns:MovingCondition to="NEXT" weekday="MONDAY">
			<tns:when>SATURDAY</tns:when>
			<tns:when>SUNDAY</tns:when>
		</tns:MovingCondition>
	</tns:Holiday>
	<tns:Holiday>
		<tns:Fixed month="NOVEMBER" day="28" descriptionPropertiesKey="INDEPENDENCE"/>
	</tns:Holiday>
	<tns:Holiday>
		<tns:Fixed month="NOVEMBER" day="29" descriptionPropertiesKey="LIBERATION"/>
	</tns:Holiday>
	<tns:Holiday>
		<tns:Fixed month="DECEMBER" day="25" descriptionPropertiesKey="CHRISTMAS"/>
	</tns:Holiday>
	<tns:Holiday>
		<tns:ChristianHoliday type="EASTER" />
	</tns:Holiday>
	<tns:Holiday>
		<tns:ChristianHoliday type="EASTER_MONDAY" />
	</tns:Holiday>
	<tns:Holiday>
		<tns:ChristianHoliday type="GOOD_FRIDAY" />
	</tns:Holiday>
	<tns:Holiday>
		<tns:IslamicHoliday type="ID_UL_ADHA" />
	</tns:Holiday>
	<tns:Holiday>
		<tns:IslamicHoliday type="ID_AL_FITR" />
	</tns:Holiday>
</tns:Configuration>
