<?xml version="1.0" encoding="UTF-8"?>
<tns:Configuration hierarchy="is" description="Iceland"
	xmlns:tns="http://www.example.org/Holiday" xmlns:xsi="http://www.w3.org/2001/XMLSchema-instance"
	xsi:schemaLocation="http://www.example.org/Holiday /Holiday.xsd">
	<tns:Holidays>
		<tns:Fixed month="APRIL" day="4"/>
		<tns:Fixed month="MAY" day="1" descriptionPropertiesKey="LABOUR_DAY"/>
		<tns:Fixed month="DECEMBER" day="26"/>
		<tns:Fixed month="DECEMBER" day="24" descriptionPropertiesKey="CHRISTMAS_EVE"/>
		<tns:Fixed month="JANUARY" day="1"/>
		<tns:Fixed month="JANUARY" day="6"/>
		<tns:Fixed month="MAY" day="13"/>
		<tns:Fixed month="DECEMBER" day="25" descriptionPropertiesKey="CHRISTMAS"/>
		<tns:Fixed month="APRIL" day="5"/>
		<tns:Fixed month="DECEMBER" day="1"/>
		<tns:Fixed month="JUNE" day="17"/>
		<tns:Fixed month="JUNE" day="24"/>
		<tns:Fixed month="DECEMBER" day="31"/>
		<tns:Fixed month="FEBRUARY" day="18"/>
		<tns:Fixed month="MARCH" day="1"/>
		<tns:Fixed month="NOVEMBER" day="16"/>
	</tns:Holidays>
</tns:Configuration>
