<?xml version="1.0" encoding="UTF-8"?>
<tns:Configuration hierarchy="it" description="Italy"
	xmlns:tns="http://jollyday.sourceforge.net/Jollyday" xmlns:xsi="http://www.w3.org/2001/XMLSchema-instance"
	xsi:schemaLocation="http://jollyday.sourceforge.net/Jollyday ../Holiday.xsd">
	<tns:Holiday>
		<tns:Fixed month="JANUARY" day="1" descriptionPropertiesKey="NEW_YEAR" />
	</tns:Holiday>
	<tns:Holiday>
		<tns:Fixed month="JANUARY" day="6" descriptionPropertiesKey="EPIPHANY" />
	</tns:Holiday>
	<tns:Holiday>
		<tns:Fixed month="APRIL" day="25" descriptionPropertiesKey="LIBERATION" />
	</tns:Holiday>
	<tns:Holiday>
		<tns:Fixed month="MAY" day="1" descriptionPropertiesKey="LABOUR_DAY" />
	</tns:Holiday>
	<tns:Holiday>
		<tns:Fixed month="JUNE" day="2" descriptionPropertiesKey="REPUBLIC_DAY" />
	</tns:Holiday>
	<tns:Holiday>
		<tns:Fixed month="AUGUST" day="15" descriptionPropertiesKey="ASSUMPTION_DAY" />
	</tns:Holiday>
	<tns:Holiday>
		<tns:Fixed month="NOVEMBER" day="1"
			descriptionPropertiesKey="ALL_SAINTS" />
	</tns:Holiday>
	<tns:Holiday>
		<tns:Fixed month="DECEMBER" day="8"
			descriptionPropertiesKey="IMMACULATE_CONCEPTION" />
	</tns:Holiday>
	<tns:Holiday>
		<tns:Fixed month="DECEMBER" day="25"
			descriptionPropertiesKey="CHRISTMAS" />
	</tns:Holiday>
	<tns:Holiday>
		<tns:Fixed month="DECEMBER" day="26"
			descriptionPropertiesKey="STEPHENS" />
	</tns:Holiday>
	<tns:Holiday>
		<tns:ChristianHoliday type="EASTER" />
	</tns:Holiday>
	<tns:Holiday>
		<tns:ChristianHoliday type="EASTER_MONDAY" />
	</tns:Holiday>
	<tns:SubConfigurations hierarchy="bz"
		description="SÃ¼dtirol">
		<tns:Holiday>
			<tns:ChristianHoliday type="WHIT_MONDAY" />
		</tns:Holiday>
	</tns:SubConfigurations>
</tns:Configuration>
