<?xml version="1.0" encoding="UTF-8"?>
<tns:Configuration hierarchy="be" description="Belgium"
	xmlns:tns="http://www.example.org/Holiday" xmlns:xsi="http://www.w3.org/2001/XMLSchema-instance"
	xsi:schemaLocation="http://www.example.org/Holiday /Holiday.xsd">
	<tns:Holidays>
		<tns:Fixed month="JANUARY" day="1" descriptionPropertiesKey="NEW_YEAR" localizedType="OFFICIAL_HOLIDAY" />
		<tns:Fixed month="MAY" day="1" descriptionPropertiesKey="LABOUR_DAY" localizedType="OFFICIAL_HOLIDAY" />
		<tns:Fixed month="JULY" day="21" descriptionPropertiesKey="NATIONAL_DAY" localizedType="OFFICIAL_HOLIDAY" />
		<tns:Fixed month="AUGUST" day="15" descriptionPropertiesKey="ASSUMPTION_DAY" />
		<tns:Fixed month="NOVEMBER" day="1" localizedType="OFFICIAL_HOLIDAY"
			descriptionPropertiesKey="ALL_SAINTS" />
		<tns:Fixed month="NOVEMBER" day="2" localizedType="UNOFFICIAL_HOLIDAY"
			descriptionPropertiesKey="ALL_SOULS" />
		<tns:Fixed month="NOVEMBER" day="11" localizedType="OFFICIAL_HOLIDAY"
			descriptionPropertiesKey="ARMISTICE" />
		<tns:Fixed month="DECEMBER" day="25" localizedType="OFFICIAL_HOLIDAY"
			descriptionPropertiesKey="CHRISTMAS" />
		<tns:Fixed month="NOVEMBER" day="15" localizedType="UNOFFICIAL_HOLIDAY"
			descriptionPropertiesKey="KINGS_FEAST" />
		<tns:Fixed month="DECEMBER" day="31" descriptionPropertiesKey="NEW_YEARS_EVE" localizedType="UNOFFICIAL_HOLIDAY" />
		<tns:ChristianHoliday type="EASTER" localizedType="OFFICIAL_HOLIDAY" />
		<tns:ChristianHoliday type="EASTER_MONDAY" localizedType="OFFICIAL_HOLIDAY" />
		<tns:ChristianHoliday type="ASCENSION_DAY" localizedType="OFFICIAL_HOLIDAY" />
		<tns:ChristianHoliday type="WHIT_MONDAY" localizedType="OFFICIAL_HOLIDAY" />
		<tns:ChristianHoliday type="PENTECOST" localizedType="OFFICIAL_HOLIDAY" />
		<tns:ChristianHoliday type="PENTECOST_MONDAY" localizedType="OFFICIAL_HOLIDAY" />
	</tns:Holidays>
</tns:Configuration>
