<?xml version="1.0" encoding="UTF-8"?>
<tns:Configuration hierarchy="pl" description="Poland"
	xmlns:tns="http://www.example.org/Holiday" xmlns:xsi="http://www.w3.org/2001/XMLSchema-instance"
	xsi:schemaLocation="http://www.example.org/Holiday Holiday.xsd ">
	<tns:Holidays>
		<tns:Fixed month="JANUARY" day="1" />
		<tns:Fixed month="MAY" day="1" />
		<tns:Fixed month="MAY" day="3" />
		<tns:Fixed month="AUGUST" day="15" />
		<tns:Fixed month="NOVEMBER" day="1" />
		<tns:Fixed month="NOVEMBER" day="11" />
		<tns:Fixed month="DECEMBER" day="25" />
		<tns:Fixed month="DECEMBER" day="26" />
		<tns:ChristianHoliday type="EASTER" />
		<tns:ChristianHoliday type="GOOD_FRIDAY" />
		<tns:ChristianHoliday type="EASTER_MONDAY" />
		<tns:ChristianHoliday type="CORPUS_CHRISTI" />
	</tns:Holidays>
</tns:Configuration>
