<?xml version="1.0" encoding="UTF-8"?>
<tns:Configuration hierarchy="fr" description="France"
	xmlns:tns="http://jollyday.sourceforge.net/Jollyday" xmlns:xsi="http://www.w3.org/2001/XMLSchema-instance"
	xsi:schemaLocation="http://jollyday.sourceforge.net/Jollyday ../../../main/resources/Holiday.xsd">
	<tns:Holiday>
		<tns:Fixed month="JANUARY" day="1" descriptionPropertiesKey="NEW_YEAR" />
	</tns:Holiday>
	<tns:Holiday>
		<tns:Fixed month="MAY" day="1" descriptionPropertiesKey="LABOUR_DAY" />
	</tns:Holiday>
	<tns:Holiday>
		<tns:Fixed month="MAY" day="8" descriptionPropertiesKey="VICTORY_DAY" />
	</tns:Holiday>
	<tns:Holiday>
		<tns:Fixed month="JULY" day="14" descriptionPropertiesKey="NATIONAL_DAY" />
	</tns:Holiday>
	<tns:Holiday>
		<tns:Fixed month="AUGUST" day="15" descriptionPropertiesKey="ASSUMPTION_MARY" />
	</tns:Holiday>
	<tns:Holiday>
		<tns:Fixed month="NOVEMBER" day="1"
			descriptionPropertiesKey="ALL_SAINTS" />
	</tns:Holiday>
	<tns:Holiday>
		<tns:Fixed month="NOVEMBER" day="11"
			descriptionPropertiesKey="REMEMBRANCE" />
	</tns:Holiday>
	<tns:Holiday>
		<tns:Fixed month="DECEMBER" day="25"
			descriptionPropertiesKey="CHRISTMAS" />
	</tns:Holiday>
	<tns:Holiday>
		<tns:Fixed month="APRIL" day="5" descriptionPropertiesKey="EASTER_MONDAY" />
	</tns:Holiday>
	<tns:Holiday>
		<tns:Fixed month="MAY" day="13" descriptionPropertiesKey="ASCENSION_DAY" />
	</tns:Holiday>
	<tns:Holiday>
		<tns:Fixed month="MAY" day="24" descriptionPropertiesKey="WHIT_MONDAY" />
	</tns:Holiday>
	<tns:SubConfigurations hierarchy="ma"
		description="Martinique">
		<tns:Holiday>
			<tns:Fixed month="MAY" day="22" />
		</tns:Holiday>
	</tns:SubConfigurations>
	<tns:SubConfigurations hierarchy="gu"
		description="Guadeloupe">
		<tns:Holiday>
			<tns:Fixed month="MAY" day="27" />
		</tns:Holiday>
	</tns:SubConfigurations>
	<tns:SubConfigurations hierarchy="gy"
		description="Guyane">
		<tns:Holiday>
			<tns:Fixed month="JUNE" day="10" />
		</tns:Holiday>
	</tns:SubConfigurations>
	<tns:SubConfigurations hierarchy="lr"
		description="La Reunion">
		<tns:Holiday>
			<tns:Fixed month="DECEMBER" day="20" />
		</tns:Holiday>
	</tns:SubConfigurations>
	<tns:SubConfigurations hierarchy="br"
		description="Bas-Rhin">
		<tns:Holiday>
			<tns:Fixed month="DECEMBER" day="26" />
		</tns:Holiday>
		<tns:Holiday>
			<tns:ChristianHoliday type="GOOD_FRIDAY" />
		</tns:Holiday>
	</tns:SubConfigurations>
	<tns:SubConfigurations hierarchy="hr"
		description="Haut-Rhin">
		<tns:Holiday>
			<tns:Fixed month="DECEMBER" day="26" />
		</tns:Holiday>
		<tns:Holiday>
			<tns:ChristianHoliday type="GOOD_FRIDAY" />
		</tns:Holiday>
	</tns:SubConfigurations>
	<tns:SubConfigurations hierarchy="mo"
		description="Moselle">
		<tns:Holiday>
			<tns:Fixed month="DECEMBER" day="26" />
		</tns:Holiday>
	</tns:SubConfigurations>
</tns:Configuration>
